<?xml version="1.0" encoding="UTF-8"?>
<ed:booking 
xmlns:ed="http://www.edreams.com"
xmlns:xsi="http://www.w3.org/2001/XMLSchema-instance"
xsi:schemaLocation="http://www.edreams.com edreams.xsd">
	<ed:flyTicket>
		<ed:journey>
			<ed:idaYVuelta />
			<ed:from WAC="PMI">Palma de Mallorca (PMI)</ed:from>
			<ed:to WAC="BCN">Barcelona (BCN)</ed:to>
		</ed:journey>
		<ed:data>
			<ed:dataFrom>2016-03-15</ed:dataFrom>
			<ed:dataTo>2016-03-30</ed:dataTo>
		</ed:data>
		<ed:traveller>
			<ed:adults>1</ed:adults>
			<ed:kids>1</ed:kids>
			<ed:baby>0</ed:baby>
		</ed:traveller>
		<ed:class>turista</ed:class>
	</ed:flyTicket>
</ed:booking>